{
  "schemaVersion": 1,
  "deploymentMode": "WindowsProduction",
  "applicationPath": "C:\\MCC\\MCC_V1_FINAL",
  "repository": "https://github.com/Recklessrage17/maintenance-command-center.git",
  "remote": "origin",
  "branch": "main",
  "port": 4273,
  "mccTaskName": "MaintenanceCommandCenter",
  "updaterTaskName": "MaintenanceCommandCenterUpdater",
  "serviceIdentity": "NT AUTHORITY\\LOCAL SERVICE",
  "agentIdentity": "NT AUTHORITY\\SYSTEM",
  "nodePath": "C:\\Program Files\\nodejs\\node.exe",
  "npmPath": "C:\\Program Files\\nodejs\\npm.cmd",
  "npmCliPath": "C:\\Program Files\\nodejs\\node_modules\\npm\\bin\\npm-cli.js",
  "gitPath": "C:\\Program Files\\Git\\cmd\\git.exe",
  "installedAt": "2026-07-29T00:00:00.0000000Z"
}
